{
  "schema_version": 1,
  "country": "CY",
  "reviewed_on": "2026-10-03",
  "official_roster_urls": [
    "https://www.gov.cy/en/government/",
    "https://www.gov.cy/en/websites/"
  ],
  "roster_complete": true,
  "limitations": [
    "The official Cyprus government roster confirms 11 ministries. Gov.cy returned access-denied content during this review, so ministry homepages, news endpoints and parser fixtures are not asserted without a separately captured HTTPS response."
  ],
  "ministries": [
    {
      "canonical_id": "cy_defence",
      "name_zh": "塞浦路斯國防部",
      "name_local": "Υπουργείο Άμυνας",
      "name_en": "Ministry of Defence",
      "kind": "ministry",
      "language": "el",
      "homepage": null,
      "news_url": null,
      "source_ids": [],
      "status": "blocked",
      "reason": "Fresh fourth-round verification: blocked. Recorded failures: robots_denied, robots_unavailable. Next action: Wait for the recorded upstream access/TLS/robots restriction to change; no bypass or automatic removal. Evidence: tests/fixtures/ministry_round4_blocked.json",
      "evidence_urls": [
        "https://www.gov.cy/en/government/",
        "https://www.gov.cy/mod/",
        "https://www.mod.gov.cy/"
      ]
    },
    {
      "canonical_id": "cy_agriculture",
      "name_zh": "塞浦路斯農業、農村發展與環境部",
      "name_local": "Υπουργείο Γεωργίας, Αγροτικής Ανάπτυξης και Περιβάλλοντος",
      "name_en": "Ministry of Agriculture, Rural Development and Environment",
      "kind": "ministry",
      "language": "el",
      "homepage": null,
      "news_url": null,
      "source_ids": [],
      "status": "blocked",
      "reason": "Fresh fourth-round verification: blocked. Recorded failures: robots_denied. Next action: Wait for the recorded upstream access/TLS/robots restriction to change; no bypass or automatic removal. Evidence: tests/fixtures/ministry_round4_blocked.json",
      "evidence_urls": [
        "https://www.gov.cy/en/government/",
        "https://www.gov.cy/moa/",
        "https://www.moa.gov.cy/"
      ]
    },
    {
      "canonical_id": "cy_justice",
      "name_zh": "塞浦路斯司法與公共秩序部",
      "name_local": "Υπουργείο Δικαιοσύνης και Δημοσίας Τάξεως",
      "name_en": "Ministry of Justice and Public Order",
      "kind": "ministry",
      "language": "el",
      "homepage": null,
      "news_url": null,
      "source_ids": [],
      "status": "blocked",
      "reason": "Fresh fourth-round verification: blocked. Recorded failures: robots_denied, robots_unavailable. Next action: Wait for the recorded upstream access/TLS/robots restriction to change; no bypass or automatic removal. Evidence: tests/fixtures/ministry_round4_blocked.json",
      "evidence_urls": [
        "https://www.gov.cy/en/government/",
        "https://www.gov.cy/mjpo/",
        "https://www.mjpo.gov.cy/"
      ]
    },
    {
      "canonical_id": "cy_energy",
      "name_zh": "塞浦路斯能源、商業與工業部",
      "name_local": "Υπουργείο Ενέργειας, Εμπορίου και Βιομηχανίας",
      "name_en": "Ministry of Energy, Commerce and Industry",
      "kind": "ministry",
      "language": "el",
      "homepage": null,
      "news_url": null,
      "source_ids": [],
      "status": "blocked",
      "reason": "Fresh fourth-round verification: blocked. Recorded failures: robots_denied. Next action: Wait for the recorded upstream access/TLS/robots restriction to change; no bypass or automatic removal. Evidence: tests/fixtures/ministry_round4_blocked.json",
      "evidence_urls": [
        "https://www.gov.cy/en/government/",
        "https://www.gov.cy/meci/",
        "https://www.meci.gov.cy/"
      ]
    },
    {
      "canonical_id": "cy_foreign_affairs",
      "name_zh": "塞浦路斯外交部",
      "name_local": "Υπουργείο Εξωτερικών",
      "name_en": "Ministry of Foreign Affairs",
      "kind": "ministry",
      "language": "el",
      "homepage": null,
      "news_url": null,
      "source_ids": [],
      "status": "blocked",
      "reason": "Fresh fourth-round verification: blocked. Recorded failures: robots_denied. Next action: Wait for the recorded upstream access/TLS/robots restriction to change; no bypass or automatic removal. Evidence: tests/fixtures/ministry_round4_blocked.json",
      "evidence_urls": [
        "https://www.gov.cy/en/government/",
        "https://www.gov.cy/mfa/",
        "https://www.mfa.gov.cy/"
      ]
    },
    {
      "canonical_id": "cy_labour",
      "name_zh": "塞浦路斯勞動與社會保險部",
      "name_local": "Υπουργείο Εργασίας και Κοινωνικών Ασφαλίσεων",
      "name_en": "Ministry of Labour and Social Insurance",
      "kind": "ministry",
      "language": "el",
      "homepage": null,
      "news_url": null,
      "source_ids": [],
      "status": "blocked",
      "reason": "Fresh fourth-round verification: blocked. Recorded failures: robots_denied. Next action: Wait for the recorded upstream access/TLS/robots restriction to change; no bypass or automatic removal. Evidence: tests/fixtures/ministry_round4_blocked.json",
      "evidence_urls": [
        "https://www.gov.cy/en/government/",
        "https://www.gov.cy/mlsi/",
        "https://www.mlsi.gov.cy/"
      ]
    },
    {
      "canonical_id": "cy_interior",
      "name_zh": "塞浦路斯內政部",
      "name_local": "Υπουργείο Εσωτερικών",
      "name_en": "Ministry of Interior",
      "kind": "ministry",
      "language": "el",
      "homepage": null,
      "news_url": null,
      "source_ids": [],
      "status": "blocked",
      "reason": "Fresh fourth-round verification: blocked. Recorded failures: robots_denied. Next action: Wait for the recorded upstream access/TLS/robots restriction to change; no bypass or automatic removal. Evidence: tests/fixtures/ministry_round4_blocked.json",
      "evidence_urls": [
        "https://www.gov.cy/en/government/",
        "https://www.gov.cy/moi/",
        "https://www.moi.gov.cy/"
      ]
    },
    {
      "canonical_id": "cy_finance",
      "name_zh": "塞浦路斯財政部",
      "name_local": "Υπουργείο Οικονομικών",
      "name_en": "Ministry of Finance",
      "kind": "ministry",
      "language": "el",
      "homepage": null,
      "news_url": null,
      "source_ids": [],
      "status": "blocked",
      "reason": "Fresh fourth-round verification: blocked. Recorded failures: robots_denied. Next action: Wait for the recorded upstream access/TLS/robots restriction to change; no bypass or automatic removal. Evidence: tests/fixtures/ministry_round4_blocked.json",
      "evidence_urls": [
        "https://www.gov.cy/en/government/",
        "https://www.gov.cy/mof/",
        "https://www.mof.gov.cy/"
      ]
    },
    {
      "canonical_id": "cy_education",
      "name_zh": "塞浦路斯教育、體育與青年部",
      "name_local": "Υπουργείο Παιδείας, Αθλητισμού και Νεολαίας",
      "name_en": "Ministry of Education, Sport and Youth",
      "kind": "ministry",
      "language": "el",
      "homepage": "https://www.moec.gov.cy/",
      "news_url": "https://enimerosi.moec.gov.cy/",
      "source_ids": [
        "cy_education"
      ],
      "status": "manual_verified",
      "reason": "Fresh fourth-round verification: manual_verified. Next action: 已驗證原文抓取與發布日期，僅供手動查詢；保留有界列表／內頁樣本的不完整警告。正式排程須另行完成升級驗收。 Evidence: tests/fixtures/ministry_round4_north.json",
      "evidence_urls": [
        "https://www.gov.cy/en/government/",
        "https://enimerosi.moec.gov.cy/"
      ]
    },
    {
      "canonical_id": "cy_transport",
      "name_zh": "塞浦路斯運輸、通信與工程部",
      "name_local": "Υπουργείο Μεταφορών, Επικοινωνιών και Έργων",
      "name_en": "Ministry of Transport, Communications and Works",
      "kind": "ministry",
      "language": "el",
      "homepage": null,
      "news_url": null,
      "source_ids": [],
      "status": "blocked",
      "reason": "Fresh fourth-round verification: blocked. Recorded failures: robots_denied. Next action: Wait for the recorded upstream access/TLS/robots restriction to change; no bypass or automatic removal. Evidence: tests/fixtures/ministry_round4_blocked.json",
      "evidence_urls": [
        "https://www.gov.cy/en/government/",
        "https://www.gov.cy/mtcw/",
        "https://www.mtcw.gov.cy/"
      ]
    },
    {
      "canonical_id": "cy_health",
      "name_zh": "塞浦路斯衛生部",
      "name_local": "Υπουργείο Υγείας",
      "name_en": "Ministry of Health",
      "kind": "ministry",
      "language": "el",
      "homepage": null,
      "news_url": null,
      "source_ids": [],
      "status": "blocked",
      "reason": "Fresh fourth-round verification: blocked. Recorded failures: robots_denied. Next action: Wait for the recorded upstream access/TLS/robots restriction to change; no bypass or automatic removal. Evidence: tests/fixtures/ministry_round4_blocked.json",
      "evidence_urls": [
        "https://www.gov.cy/en/government/",
        "https://www.gov.cy/moh/",
        "https://www.moh.gov.cy/"
      ]
    }
  ]
}
